{
  "schema_version": "1.0.0",
  "source_id": "sw-golden-0002-low-medium",
  "mode": "Idea Inbox",
  "captured_at": "2026-08-02T09:00:00Z",
  "transcript": "Fixture transcript: thinking I should read through the backlog of saved articles at some point, no rush, maybe over the winter.",
  "first_pass_note": "Read through saved-articles backlog eventually, no rush.",
  "language": "en",
  "duration_seconds": 5.1,
  "device": "fixture-generator/1.0"
}
