{
  "schema_version": "1.0.0",
  "source_id": "sw-golden-0001-low-low",
  "mode": "Idea Inbox",
  "captured_at": "2026-08-01T09:00:00Z",
  "transcript": "Mumbled fixture transcript, partly unclear: something about maybe reorganizing the garage shelf someday, or was it the basement, hard to tell from the recording quality.",
  "first_pass_note": "Vague idea about reorganizing a shelf, garage or basement, unclear.",
  "language": "en",
  "duration_seconds": 6.2,
  "device": "fixture-generator/1.0"
}
